{"schema_version": 1, "triggers": [{"id": "T-001", "state": "refuted", "reason": "claim C-1 is refuted: L1 head case \"empty\" contradicts it"}, {"id": "T-002", "state": "covered", "reason": "module.aurora.aws_rds_cluster.this.vpc_security_group_ids is planned in examples/complete"}, {"id": "T-003", "state": "inert", "reason": "the entry is inert"}], "capped": 0, "claims": [{"claim_id": "C-1", "state": "refuted", "reason": "L1 head case \"empty\" contradicts it", "trigger_id": "T-001", "revision": "head"}], "discarded_claims": [{"claim_id": "claims[1]", "reason": "not a claim object"}, {"claim_id": "C-3", "reason": "params.node is not a trigger id (T-nnn)"}]}
